authors,date_download,date_modify,date_publish,description,filename,image_url,language,localpath,maintext,source_domain,title,title_page,title_rss,url,mentioned_companies,named_entities,sentiment,emotion,file_id,month_publish
['Jon Fingas'],2021-05-02 22:46:43+00:00,,2021-05-02 21:22:41,Apple is now known to have a deal that could bring blood sugar monitoring to future Watch models — a significant help to diabetics.,https%3A%2F%2Ffinance.yahoo.com%2Fnews%2Fapple-watch-blood-sugar-rockley-photonics-212241562.html.json,https://s.yimg.com/os/creatr-uploaded-images/2021-04/38adaa90-9d1d-11eb-bdfc-a97199bc2217,en,,"The longstanding rumors of an Apple Watch with blood sugar monitoring just gained some credibility. The Telegraph and Forbes report that UK health tech firm Rockley Photonics recently confirmed in an SEC filing that Apple has been its largest customer for the past two years, and that it has a continuing deal to develop future products. Rockley's focus has been on sensors that track blood glucose, pressure and even alcohol levels, suggesting that at least one of these features will be available in a future Apple Watch.
Apple's support for diabetics has so far been limited to carrying third-party monitors in its stores.
There's no guarantee the Rockley deal will lead to shipping products. Apple hasn't been shy about focusing the Apple Watch on health, however, and there's plenty of industry interest in developing wearable blood sugar sensors that don't require needles. If Apple can build the technology into a mainstream product like the Watch, it could offer an advantage to anyone tired of jabbing themselves to keep their diabetes in check.
Rockley's other technologies could help, too. Blood pressure tracking could alert you to issues like stress, and alcohol monitoring might keep your drinking in moderation. Whether or not that's feasible is another matter. Apple still has to consider factors like battery life and price, and it's entirely possible that you could be waiting a while for all these features (assuming they ever ship) even if the tech is otherwise ready.",finance.yahoo.com,Apple Watch could get blood sugar monitoring thanks to a UK tech deal,,,https://finance.yahoo.com/news/apple-watch-blood-sugar-rockley-photonics-212241562.html,['AAPL'],"[{'entity_group': 'ORG', 'word': 'Apple Watch', 'normalized': 'Apple Watch', 'company_key': None, 'start': 30, 'end': 41, 'score': 0.9297623634338371}, {'entity_group': 'ORG', 'word': 'Telegraph and Forbes', 'normalized': 'Telegraph and Forbes', 'company_key': None, 'start': 104, 'end': 124, 'score': 0.859685182571411}, {'entity_group': 'LOC', 'word': 'UK', 'normalized': 'UK', 'company_key': None, 'start': 137, 'end': 139, 'score': 0.963991522789001}, {'entity_group': 'ORG', 'word': 'Rockley Photonics', 'normalized': 'Rockley Photonics', 'company_key': None, 'start': 157, 'end': 174, 'score': 0.998731255531311}, {'entity_group': 'ORG', 'word': 'SEC', 'normalized': 'SEC', 'company_key': None, 'start': 200, 'end': 203, 'score': 0.995721220970153}, {'entity_group': 'ORG', 'word': 'Apple', 'normalized': 'AAPL', 'company_key': 'AAPL', 'start': 216, 'end': 221, 'score': 0.9988232254981991}, {'entity_group': 'ORG', 'word': 'Rockley', 'normalized': 'Rockley', 'company_key': None, 'start': 338, 'end': 345, 'score': 0.9741985797882081}, {'entity_group': 'ORG', 'word': 'Apple Watch', 'normalized': 'Apple Watch', 'company_key': None, 'start': 511, 'end': 522, 'score': 0.7838091850280761}, {'entity_group': 'ORG', 'word': 'Apple', 'normalized': 'AAPL', 'company_key': 'AAPL', 'start': 524, 'end': 529, 'score': 0.9990517497062681}, {'entity_group': 'ORG', 'word': 'Rockley', 'normalized': 'Rockley', 'company_key': None, 'start': 651, 'end': 658, 'score': 0.654981553554534}, {'entity_group': 'ORG', 'word': 'Apple', 'normalized': 'AAPL', 'company_key': 'AAPL', 'start': 696, 'end': 701, 'score': 0.9989901185035701}, {'entity_group': 'ORG', 'word': 'Apple', 'normalized': 'AAPL', 'company_key': 'AAPL', 'start': 737, 'end': 742, 'score': 0.785424888134002}, {'entity_group': 'MISC', 'word': 'Watch', 'normalized': 'Watch', 'company_key': None, 'start': 743, 'end': 748, 'score': 0.5942890048027031}, {'entity_group': 'ORG', 'word': 'Apple', 'normalized': 'AAPL', 'company_key': 'AAPL', 'start': 883, 'end': 888, 'score': 0.9983356595039361}, {'entity_group': 'ORG', 'word': 'Watch', 'normalized': 'Watch', 'company_key': None, 'start': 949, 'end': 954, 'score': 0.5602836608886711}, {'entity_group': 'ORG', 'word': 'Rockley', 'normalized': 'Rockley', 'company_key': None, 'start': 1055, 'end': 1062, 'score': 0.94279009103775}, {'entity_group': 'ORG', 'word': 'Apple', 'normalized': 'AAPL', 'company_key': 'AAPL', 'start': 1277, 'end': 1282, 'score': 0.9988075494766231}]","{'negative': 0.000175810157088, 'neutral': 0.00046107752132200006, 'positive': 0.9993631243705751}","{'neutral': 0.906628787517547, 'joy': 0.051905483007431, 'surprise': 0.026733370497822, 'anger': 0.005532005801796001, 'fear': 0.0034136511385440002, 'sadness': 0.00312571413815, 'disgust': 0.002661026082932}",2021/fdc6ab6b3ac09bf018781b0ee031d4d15f997707d769352fa601c047fb061037.json,5
