authors,date_download,date_modify,date_publish,description,filename,image_url,language,localpath,maintext,source_domain,title,title_page,title_rss,url,mentioned_companies,named_entities,sentiment,emotion,file_id,month_publish
['Steve Gillmor'],2021-05-03 05:00:04+00:00,,2021-05-03 03:10:36,"Clubhouse hosted another excellent conversation between Josh Constine and Facebook's audio czar Fidji Simo. The format continues to sparkle, as I was once again forced to choose between MSNBC's Rachel Maddow or Lawrence O'Donnell and just plain audio. JPA won going away.",https%3A%2F%2Ffinance.yahoo.com%2Fnews%2Fgillmor-gang-walk-dinosaur-031036795.html.json,https://s.yimg.com/uu/api/res/1.2/rdMmssxmJPGcK0LQl1_xNQ--~B/aD0xMDgwO3c9MTkyMDthcHBpZD15dGFjaHlvbg--/https://media.zenfs.com/en/techcrunch_350/4f45a198bafd3582ecb264bfe557daad,en,,"Clubhouse hosted another excellent conversation between Josh Constine and Facebook's audio czar Fidji Simo. The format continues to sparkle, as I was once again forced to choose between MSNBC's Rachel Maddow or Lawrence O'Donnell and just plain audio. JPA won going away. The talk was crisp and the strategies thick with optimism about the creator economy. Monetization, priming the emergent pump, etc. If this were the Gold Rush, it would be blue skies ahead for picks and shovels and pans.
It remains hard to listen to the creator talk. If this is the moment for creators, then what is the moment for us listening? The question is who gets the short end of the crypto stick, a zero sum game where the losers are the equivalent of who buys high and sells low. I guess in the elegant world of startups, being one and not the other nine of ten is worth it.
It's still damn exciting to see the outcome at a safe distance from ground zero. Once the tech companies run out of slots at the start of the race, there will be plenty of industries waiting for the early smoke to clear. Walmart, table for two? This is not a live audio story but rather a realignment of the media industries around notifications. Let's approach the rebuild of the economy and our way of life from the inside out, or backwards in a kind of reverse engineered insight replayed forward like a Beatles guitar solo.
Back before the virus, we thought of life as weekday and weekends, work week or vacation, a series of not-holidays punctuated by long weekends every 6 to 8 weeks or so.We paced ourselves in waves: not liking Mondays to hump days to going to the movies on Friday to watching the political shows on Sunday. Enduring the nightmare that was Trump, sedating us with the binge economy as it surfed the streaming disruption, addicted to our phones and awestruck by the possibilities of the hive mind. Things changed, and then the plague struck.
Now we realized our folly, not in assuming the unassumable but in thinking we had any clue at all of how much time we had to dream about the future. Our belief in technology was still there, but not necessarily how it would work. Saving us was a goal, not a sure thing or even close. We held our breath. And got incredibly lucky. Time inverted itself, and in surviving we found a desperate grace in treasuring our networks of family and friends.
As much as we knew everything was different, we were shocked at how quickly we adapted to the crisis. The rapid deployment of mobile and social technology over the previous couple decades was suddenly ratified, accelerated, and made table stakes. Not surprisingly the tech companies were able to consume the wave; the startup surge was financed by eating its own dog food. Remember Y2K, where it was still not a sure thing there was any real ROI for collaboration, or groupware as it was pigeonholed.
It got a lot harder to say digital collaboration was not realistic. The Cloud made corporate transformation a subscription service going in and pivoting to market fit a viable exit strategy. Startups could scale up without multi-million dollar bets, leaving enterprise incumbents with no choice but to adopt Software As A Service to survive. Consumer laptops, TCPIP, and 2400 baud modems became the platform where continuous innovation found a home, virtualizing the office as a set of familiar services deployed both on desktop and phones.
Notifications became less a source of interruption and more the quickest way to manage the converging streams of work and personal life. These intermittent alerts allowed us to navigate multiple conversations and interactions on an as-needed basis. Collaboration tools orchestrated the abstraction of email with group messaging, video conferencing became a time saver and easy onboarding tool, screen sharing an IT replacement. And all sat on the notification backbone, reducing channel conflict and shifting the social aspects of team engagement to a more personal basis. And then the pandemic happened.
Is it any wonder, the Bowie song asks. Notification etiquette kicks in at daybreak with the overnight roundup, tracks the news throughout while avoiding the repetitive eyeball-baiting of the cable networks, and creates a calendar of things to click on or store for free time or cram for a meeting. No, it's not any wonder that audio fits more and more into this work-from-wherever climate shift. Notification chimes differentiate between critical alerts, parkable alerts, and ignorable scroll-offs. Newsletters become havens for binging cached 10 minute reads, managing live audio and recorded podcasts, and a rallying point for influencer analytics. This last one offers value for not just creators but consumers, also known as tippers.
The creator bandwagon sounds promising, but who cares which major platform captures the pole position? I like Clubhouse's work in establishing a complementary social cloud via notifications. I like Twitter Spaces as a driver to squeeze a record button into the UI for all, just as Anchor does for podcasting. I like the idea of Facebook sneaking onto the playing field by allowing Instagram to turn off video. Wow, thanks. I love how Josh Constine seems to have landed in just the right place to triangulate his venture casting chops, reportorial finesse, handy summarizing of the calls, and matter-of-fact direct to podcast strategy.
But these early winners in format and style should soon give way to a more constructive dialogue between creators and their listeners. Newsletter platforms seem to have made the case that a few hit writers will pay for developing tools to support subscriptions, distribution, legal services, analytics, and more. I keep wanting to backchannel directly with specific people in the room, but Clubhouse doesn't want that to happen natively. We're live audio, not chat, they don't say but imply. What if listeners could sign up for receiving (and sending) commentary via some form of group @mention. Moderators could tap into that and invite people onstage to engage with speakers. Organic discovery of talent and impact. Sign me up.
from the Gillmor Gang Newsletter
__________________
The Gillmor Gang — Frank Radice, Michael Markman, Keith Teare, Denis Pombriant, Brent Leary and Steve Gillmor. Recorded live Friday, April 25, 2021.
Produced and directed by Tina Chase Gillmor @tinagillmor
@fradice, @mickeleh, @denispombriant, @kteare, @brentleary, @stevegillmor, @gillmorgang
Subscribe to the new Gillmor Gang Newsletter and join the backchannel here on Telegram.",finance.yahoo.com,Gillmor Gang: Walk the Dinosaur,,,https://finance.yahoo.com/news/gillmor-gang-walk-dinosaur-031036795.html,['FB'],"[{'entity_group': 'ORG', 'word': 'Clubhouse', 'normalized': 'Clubhouse', 'company_key': None, 'start': 0, 'end': 9, 'score': 0.7139456272125241}, {'entity_group': 'PER', 'word': 'Josh Constine', 'normalized': 'Josh Constine', 'company_key': None, 'start': 56, 'end': 69, 'score': 0.9811964035034181}, {'entity_group': 'ORG', 'word': 'Facebook', 'normalized': 'FB', 'company_key': 'FB', 'start': 74, 'end': 82, 'score': 0.986394107341766}, {'entity_group': 'PER', 'word': 'Fi', 'normalized': 'Fi', 'company_key': None, 'start': 96, 'end': 98, 'score': 0.9990344047546381}, {'entity_group': 'PER', 'word': '##ji Simo', 'normalized': '##ji Simo', 'company_key': None, 'start': 99, 'end': 106, 'score': 0.9764325618743891}, {'entity_group': 'ORG', 'word': 'MSNBC', 'normalized': 'MSNBC', 'company_key': None, 'start': 186, 'end': 191, 'score': 0.9914231300354001}, {'entity_group': 'PER', 'word': 'Rachel Maddo', 'normalized': 'Rachel Maddo', 'company_key': None, 'start': 194, 'end': 206, 'score': 0.815173327922821}, {'entity_group': 'PER', 'word': ""Lawrence O ' Donnell"", 'normalized': ""Lawrence O ' Donnell"", 'company_key': None, 'start': 211, 'end': 229, 'score': 0.9759921431541441}, {'entity_group': 'ORG', 'word': 'JPA', 'normalized': 'JPA', 'company_key': None, 'start': 252, 'end': 255, 'score': 0.9979566335678101}, {'entity_group': 'MISC', 'word': 'Gold Rush', 'normalized': 'Gold Rush', 'company_key': None, 'start': 420, 'end': 429, 'score': 0.997959971427917}, {'entity_group': 'ORG', 'word': 'W', 'normalized': 'W', 'company_key': None, 'start': 1077, 'end': 1078, 'score': 0.977243781089782}, {'entity_group': 'ORG', 'word': '##almart', 'normalized': '##almart', 'company_key': None, 'start': 1078, 'end': 1084, 'score': 0.9418729543685911}, {'entity_group': 'MISC', 'word': 'Beatles', 'normalized': 'Beatles', 'company_key': None, 'start': 1363, 'end': 1370, 'score': 0.9766466021537781}]","{'negative': 0.000638463825453, 'neutral': 0.9181099534034721, 'positive': 0.081251643598079}","{'neutral': 0.8976029753684991, 'joy': 0.049359124153852005, 'surprise': 0.024665491655468, 'sadness': 0.009778598323464002, 'anger': 0.006574867758899001, 'fear': 0.006164876744151, 'disgust': 0.005853946320712001}",2021/9c4c094ca59df0c38ea5e0c7199297dfec6fdae1e07c5ac2faf2991d94acc89c.json,5
