authors,date_download,date_modify,date_publish,description,filename,image_url,language,localpath,maintext,source_domain,title,title_page,title_rss,url,mentioned_companies,named_entities,sentiment,emotion,file_id,month_publish
['Kessler Topaz Meltzer & Check LLP'],2021-05-02 15:26:02+00:00,,2021-05-02 14:15:00,"RADNOR, Pa., May 02, 2021 (GLOBE NEWSWIRE) -- The law firm of Kessler Topaz Meltzer & Check, LLP announces that a securities fraud class action lawsuit has been filed in the United States District Court for the District of Maryland against Emergent BioSolutions Inc. (NYSE: EBS) (“Emergent”) on behalf of those who purchased or acquired Emergent common stock between July 6, 2020 and March 31, 2021, inclusive (the “Class Period”). Deadline Reminder: Investors who purchased or acquired Emergent common stock during the Class Period may, no later than June 18, 2021, seek to be appointed as a lead plaintiff representative of the class. For additional information or to learn how to participate in this litigation please contact Kessler Topaz Meltzer & Check, LLP: James Maro, Esq. (484) 270-1453 or Adrienne Bell, Esq. (484) 270-1435; toll free at (844) 887-9500; via e-mail at info@ktmc.com; or click https://www.ktmc.com/emergent-biosolutions-class-action-lawsuit?utm_source=PR&utm_medium=Link&utm_campaign=emergent Emergent is a specialty biopharmaceutical company that develops vaccines and antibody therapeutics for infectious diseases. The Class Period commences on July 6, 2020, when Emergent issued a press release announcing that it had signed a five-year agreement for large-scale drug substance manufacturing for Johnson & Johnson’s (“J&J”) lead COVID-19 vaccine candidate. Under the agreement, valued at $480 million for the first two years, Emergent would begin manufacturing J&J’s COVID-19 vaccine in 2021 at Emergent’s manufacturing facility in Baltimore. In announcing the agreement, Emergent’s President and Chief Executive Officer, Robert G. Kramer Sr., highlighted Emergent’s “manufacturing strength to address the COVID-19 pandemic.” Emergent’s Senior Vice President, Syed T. Husain, added that Emergent had “the expertise and capabilities to meet the long-term needs of [its] customers and provide ongoing commercial manufacturing to benefit patients.” Shortly thereafter, on July 27, 2020, Emergent issued a press release announcing another deal with AstraZeneca to provide services to support production of its COVID-19 vaccine candidate. This deal, valued at approximately $174 million, also contracted Emergent to produce drug substance manufacturing services at its Baltimore facility, beginning in 2020, at a large scale for commercial supply. The truth about Emergent was revealed on March 31, 2021 after the close of markets, when The New York Times published an article reporting on the accidental contamination of COVID-19 vaccines developed by J&J and AstraZeneca at the Emergent manufacturing plant in Baltimore. The New York Times article stated that in late February 2021, employees at Emergent’s Baltimore manufacturing plant inconceivably “mixed up” ingredients of the two different COVID-19 vaccines, contaminating up to 15 million doses of J&J’s vaccine and forcing regulators to delay authorization of the plant’s production lines. Further, The New York Times article noted that Emergent’s massive vaccine lot contamination went undiscovered for days until J&J’s quality control checks uncovered it, raising questions about Emergent’s failed training and supervision of its employees during the production process. Following this news, Emergent’s stock price dropped from a close of $92.91 on March 31, 2021, down to a close of $80.46 on April 1, 2021, a drop of over 13%. As more facts unfolded in the media, Emergent’s stock price continued to decline, closing at $78.62 on April 5, 2021. The complaint alleges that throughout the Class Period, the defendants failed to disclose that: (i) Emergent’s Baltimore plant had a history of manufacturing issues increasing the likelihood for massive contaminations; (ii) these longstanding contamination risks and quality control issues at Emergent’s facility led to a string of U.S. Food and Drug Administration citations; (iii) Emergent previously had to discard the equivalent of millions of doses of COVID-19 vaccines after workers at the Baltimore plant deviated from manufacturing standards; and (iv) as a result of the foregoing, the defendants’ public statements about Emergent’s ability and capacity to mass manufacture multiple COVID-19 vaccines at its Baltimore manufacturing site were materially false and/or misleading and/or lacked a reasonable basis. Emergent investors may, no later than June 18, 2021, seek to be appointed as a lead plaintiff representative of the class through Kessler Topaz Meltzer & Check, LLP or other counsel, or may choose to do nothing and remain an absent class member. A lead plaintiff is a representative party who acts on behalf of all class members in directing the litigation. In order to be appointed as a lead plaintiff, the Court must determine that the class member’s claim is typical of the claims of other class members, and that the class member will adequately represent the class. Your ability to share in any recovery is not affected by the decision of whether or not to serve as a lead plaintiff. Kessler Topaz Meltzer & Check, LLP prosecutes class actions in state and federal courts throughout the country involving securities fraud, breaches of fiduciary duties and other violations of state and federal law. Kessler Topaz Meltzer & Check, LLP is a driving force behind corporate governance reform, and has recovered billions of dollars on behalf of institutional and individual investors from the United States and around the world. The firm represents investors, consumers and whistleblowers (private citizens who report fraudulent practices against the government and share in the recovery of government dollars). The complaint in this action was not filed by Kessler Topaz Meltzer & Check, LLP. For more information about Kessler Topaz Meltzer & Check, LLP please visit www.ktmc.com. CONTACT: Kessler Topaz Meltzer & Check, LLPJames Maro, Jr., Esq.Adrienne Bell, Esq.280 King of Prussia RoadRadnor, PA 19087(844) 887-9500 (toll free)info@ktmc.com",https%3A%2F%2Ffinance.yahoo.com%2Fnews%2Febs-equity-alert-kessler-topaz-141500943.html.json,https://s.yimg.com/uu/api/res/1.2/Y5sl3G577FvfiJmHkQXgJw--~B/aD02MDA7dz0xMjc1O2FwcGlkPXl0YWNoeW9u/https://media.zenfs.com/en/globenewswire.com/ac039c7cc282c0926f1e78551bc7a7be,en,,"National Review
American Federation of Teachers Union Influenced CDC on In-Person-Learning Guidelines
The American Federation of Teachers influenced the Centers for Disease Control and Prevention’s February guidelines on reopening schools, according to emails reported by the New York Post on Saturday. At least two language suggestions made by the AFT were adopted in some form in the final text of the CDC’s guidelines, the Post found. The emails were provided to the paper by Americans for Public Trust, a conservative watchdog group that obtained the documents through a Freedom of Information Act request. While the CDC was preparing to declare that all schools could provide in-person learning regardless of the degree of community spread of coronavirus, AFT senior director for health issues Kelly Trautner proposed adding new language. “In the event of high community-transmission results from a new variant of SARS-CoV-2, a new update of these guidelines may be necessary,” Trautner’s suggestion read. The language was added as part of the CDC’s guidance on reopening. The AFT also pushed for exemptions from in-person work for teachers and staff at higher risk of susceptibility to coronavirus, as well as staff with a family member at high risk for COVID-19. Language outlining these exemptions was adopted as part of the final CDC guidance. “Thank you again for Friday’s rich discussion about forthcoming CDC guidance and for your openness to the suggestions made by our president, Randi Weingarten, and the AFT,” Trautner wrote in a February 1 email. “We were able to review a copy of the draft guidance document over the weekend and were able to provide some initial feedback to several staff this morning about possible ways to strengthen the document.” That email was forwarded to CDC director Dr. Rachel Walensky by White House coronavirus testing coordinator Carol Johnson. The CDC and AFT said discussions between the two agencies are routine, in comments to the Post. “Naturally, we have been in regular touch with the agencies setting policy that affect [school employees’] work and lives, including the CDC,” AFT spokeswoman Oriana Korin said, noting that the union held similar conversations with the Trump administration. The Biden administration initially struggled to reopen schools for full in-person learning before the summer vacation. Reopening has faced significant pushback from some teachers unions, with the head of the Los Angeles teachers union alleging in March that California’s reopening plan propagated “structural racism,” while in Chicago a reopening agreement was reached in February after months of failed negotiations between the city and teachers union. As of May 2, 4 percent of U.S. school districts are holding all-remote classes, with 47 percent holding full in-person learning. Meanwhile, 48 percent of districts are operating a hybrid schedule of in-person and remote learning, according to the American Enterprise Institute’s Return to Learn Tracker.
Bloomberg
Fed’s Kaplan Wants to Talk Taper, Breaks Ranks With Powell
(Bloomberg) -- Discover what’s driving the global economy and what it means for policy makers, businesses, investors and you with The New Economy Daily. Sign up hereSigns of excess risk taking in financial markets show it’s time for the U.S. central bank to start debating a reduction in its massive bond purchases, said the president of the Dallas Federal Reserve, breaking ranks with Chair Jerome Powell.“We’re now at a point where I’m observing excesses and imbalances in financial markets,” said Robert Kaplan during a virtual event Friday. “I’m very attentive to that, and that’s why I do think at the earliest opportunity I think will be appropriate for us to start talking about adjusting those purchases.”Kaplan is not a voter this year on the policy-setting Federal Open Market Committee. The Dallas Fed chief has been one of the Fed’s more hawkish officials and has said that he projects the central bank will raise interest rates next year. The median estimate of the 18 policy makers is that rates will stay near zero through 2023.His remarks contradict Powell, who told reporters Wednesday that the “time is not yet” to talk about tapering the Fed’s $120 billion monthly pace of bond buying.”It’s not surprising that Kaplan is making a case now for tapering because he’s already been making the case,” said Brett Ryan, senior U.S. economist at Deutsche Bank AG. “The surprising thing is that it’s so soon right after Chair Powell had been very explicit in saying now is not the time to talk about tapering. That’s the dichotomy there.”Powell spoke after the FOMC unanimously voted to hold interest rates near zero and repeated it would maintain the pace of bond buying until “substantial further progress” had been made on its goals for employment and inflation.Kaplan, the first official to speak publicly snce the post-FOMC blackout period ended, said that threshold was approaching faster than anticipated as the U.S. economy recovers from the pandemic.“I think we’re going to reach that benchmark sooner than I would have expected in January and others would have expected,” he said. “I think the U.S. economy will be far healthier when we have the ability to start weaning off those purchases.”A stock market at record highs, tight credit spreads and private investors driving up housing prices all point to imbalances in financial markets, Kaplan said. He’s paying particular attention to investors buying up single-family properties, often using all-cash offers to outbid families looking to purchase their first home.“We’ve got real excesses in the housing market,” Kaplan said. “It’s not yet the speculative situation that we had back in ‘07, ‘08 and ‘09, but I think it bears watching and keeping a close eye on.”(Updates with more details starting in the third paragraph.)For more articles like this, please visit us at bloomberg.comSubscribe now to stay ahead with the most trusted business news source.©2021 Bloomberg L.P.
Benzinga
Berkshire Hathaway's Charlie Munger Says Bitcoin Is 'Disgusting And Contrary To Interests Of Civilization'
The inevitable question came up about Bitcoin (CRYPTO: BTC) during today's Berkshire Hathaway Inc (NYSE: BRK-A)(NYSE: BRK-B) 2021 shareholders meeting with Warren Buffett and Charlie Munger. Buffett Dodges: Buffett, chairman of Berkshire Hathaway, said he hates it when he sees politicians dodge questions, but that he would do so himself on the question of Bitcoin. ""We had a governor one time in Nebraska, a long time ago, and he would get a tough question, you know. 'What do you think about property taxes?' or 'What should we do about schools?' and he'd look right at the person, and he'd say, 'I'm all right on that one!' and he'd walk off. Well, I'm all right on that one,"" Buffett said before turning it over to Vice Chairman Munger. See Also: How To Buy Bitcoin Munger Weighs In: ""Those who know me well are just waving the red flag to the bull,"" Munger said. ""Of course, I hate the Bitcoin success. I don't welcome a currency that's so useful to kidnappers and extortionists and so forth. Nor do I like just shuffling out a few extra billions and billions and billions of dollars to someone who just invented a new financial product out of thin air. I think I should say modestly that I think the whole damned development is disgusting and contrary to the interests of civilization, and I'll leave the criticism to others."" To which Buffett responded, ""I'm all right on that one!"" Earlier in February, Munger had said that trading cryptocurrencies is ""just dementia"" and that the price of Bitcoin was far too volatile to be a mainstream medium of exchange. ""It's really kind of an artificial substitute for gold, and since I never buy any gold, I never buy any Bitcoin. I recommend that other people follow my practice,"" he said. Bitcoin reached a new record high of over $63,000 on April 13. Price Action: Bitcoin is up 96.62% year-to-date. Bitcoin is up slightly by 1.76% in the last 24 hours at $57,776. See more from BenzingaClick here for options trades from BenzingaWarren Buffett And Charlie Munger Talk Economy, Markets At Berkshire Hathaway Annual Meeting 2021Berkshire Hathaway Posts Strong First-Quarter Operating Earnings of Billion© 2021 Benzinga.com. Benzinga does not provide investment advice. All rights reserved.
InvestorPlace
Is Dogecoin Dead? Elon Musk and Mark Cuban Say ‘So Much No’
When Dogecoin (CCC:DOGE-USD) enthusiasts created #DogeDay, many hoped that Dogecoin prices would go to $1. Even fifty cents would have been acceptable. Source: Shutterstock Instead, Apr. 20 marked one of Dogecoin’s worst days on record. Within hours, the coin had dropped from its open of around 40 cents to a close of 32 cents. By the end of the week, the “meme coin” had sunk below 20 cents, wiping out $25 billion of investor wealth. “There was anxiety with larger investors who had big positions that the dog had its day coming and wanted to exit,” said Eric Schiffer, the head of a private equity firm called The Patriarch Organization.InvestorPlace - Stock Market News, Stock Advice & Trading Tips For all purposes, it looked like Dogecoin was dead. But momentum bulls would have the last laugh. As celebrities like Mark Cuban and Elon Musk began tweeting about the cryptocurrency, investors began to buy back in. Almost magically, Dogecoin prices started to rise again. 10 of the Top Nasdaq Blue-Chip Stocks to Buy Now, as investors try to make sense of an asset with “zero intrinsic value,” momentum investors will continue to confound traditional ones. As this week has shown, Dogecoin might be dead — but just not quite yet. Dogecoin Prices: The World’s $40 Billion Prank Cryptocurrency’s biggest inside joke has long confused conventional investors. All coins already have zero intrinsic value and Dogecoin made a point to satirize that fact. Its original 2013 code awarded up to one billion coins per solved block, making DOGE virtually unusable as a form of currency. Fast forward to 2021, however, and DOGE has emerged as one of the most serious money-makers of the year. $10,000 invested in Dogecoin at the start of the year would have turned to over $870,000 at its peak. Ordinary retail investors became overnight millionaires. Technologically, Dogecoin has also grown up. Its once ludicrous mining reward system now runs on a system that mimics a 2.5% inflation rate. A “merged mining” ability also allows miners to process DOGE in parallel with Litecoin (CCC:LTE-USD), significantly increasing its mining pool. Yet, Dogecoin prices seem to have a life of their own. Its major technological overhauls in 2014 coincided with a huge collapse in value. Three years later, the opposite was true; though development virtually ceased in Q1 2017, Dogecoin prices would rise 3700% by the end of that year. The explanation for these movements varies, from a failed Reddit investment scheme to a broader cryptocurrency mania. Recently, DOGE price movements have become stranger still. On Jan. 28, Tesla (NASDAQ:TSLA) CEO Elon Musk tweeted the first of many posts referencing Dogecoin — a photoshopped issue of “Dogue” magazine with Cinza the Whippet on the cover. DOGE prices jumped 500% by the next day, creating a pattern of price rises following any mention by the new Tweeter-in-Chief. Source: Thompson Reuters Dogecoin prices after Elon Musk tweet Other celebrities have since jumped on board. In February, billionaire Mark Cuban told Forbes that he had bought Dogecoin for his son. “It’s fun, it’s exciting and educational for him,” Cuban said during the interview. “It gives you a better chance of winning than a lottery ticket.” That educational lesson might have earned investors billions. By mid-April, Dogecoin’s prices rose so high that it briefly replaced XRP (CCC:XRP-USD) as the world’s fourth-largest currency. The Driving Forces of Dogecoin When cryptocurrencies took off in the early 2010s, Bitcoin (CCC:BTC-USD) dominated. Creating new wallets was a cumbersome process and few investors ventured beyond what they already knew. As such, Bitcoin held at least 95% market dominance through 2016. As high-quality exchanges started appearing, however, Bitcoin’s early lead became less critical. Newer exchanges allowed customers to buy dozens of different coins without creating a new wallet for each currency. The technological barriers to new altcoins started to crumble. In its place, the power of celebrity started taking over. Coins like Cardano (CCC:ADA-USD), Polkadot (CCC:DOT-USD) and Stellar (CCC:XLM-USD) soon climbed the crypto ranks thanks to their all-star development teams. In some cases, technology didn’t even seem to matter. In March, Tron (CCC:TRON-USD) CEO Justin Sun made headlines after losing a high-profile $69 million auction for the most expensive NFT (non-fungible token) artwork to date. The currency of the well-known “hype man of the century” would go on to nearly quadruple by mid-April, despite Tron’s severe plagiarism issues (Sun would go on to blame this on bad “translation”). Today, these same celebrity forces are now driving Dogecoin prices higher. It doesn’t seem to matter that Dogecoin has virtually no development team, nor that its technology is practically identical to Litecoin’s. As more high-profile names jump on board, the cryptocurrency’s price only seems to go in one direction: up. Momentum Becomes the Driving Force Dogecoin’s “celebrity effect” has also coincided with a broader shift towards momentum investing — a byproduct of social media’s role in promoting cryptocurrencies. Many coins now have dedicated fan bases who unwittingly create feedback loops in a coin’s price. Rising prices draw more social-media interest, which causes more buyers to join and so on. The results have been nothing short of breathtaking. An investor who bought one the top-10 mentioned new coins on Twitter in mid-2020 could have seen their investment triple the return of Bitcoin. (Only one of these typically risky initial coin offerings, or ICOs, would sink from its initial price.) The rise of momentum investing has even caught several experienced crypto investors off guard. In May 2020, California-based Cryptolab Capital shuttered its doors after a string of poor Bitcoin returns. Firms like Virgil Capital would resort to fraud to keep the illusion of success going. Momentum, however, is a double-edged sword. The same “hot money” investors are often the first to sell, creating an unrelenting downward spiral. That’s why Dogecoin’s 50% decline last week had investors concerned. Without intervention, the coin was surely set to fall further. Elon Musk to the Rescue Fortunately for Dogecoin holders, though, the coin’s backers had other plans. As Elon Musk and fellow celebrities took to social media in support, DOGE prices started to rise. By the time Musk tweeted “The Dogefather” at 2:20 a.m. on Apr. 28, prices would hit 32 cents the following morning. For Dogecoin, these recoveries matter. Most late-game cryptocurrency investors are “buyers looking to make money,” notes Richard Partington, economics correspondent at The Guardian. Price declines tend to trigger more selling. Trading volume makes the case. DOGE’s initial run to 40 cents coincided with a flurry of buying. As prices came down, volumes remained elevated. In other words, investors were selling out faster than new buyers were entering. Chartists often frustrate fundamental stock pickers with terms like “breakouts” to describe initial price gains leading to further rises (or vice versa to the downside). In the case of Dogecoin, they have a point — a small nudge by a well-timed tweet can become the catalyst to send DOGE to the moon. So, with Dogecoin, invest thoughtfully. It’s no longer investors who are in control of the rocket ship; it’s the famous backers who support the currency of this strange new world. On the date of publication, Tom Yeung did not have (either directly or indirectly) any positions in the securities mentioned in this article. Tom Yeung, CFA, is a registered investment advisor on a mission to bring simplicity to the world of investing. More From InvestorPlace Why Everyone Is Investing in 5G All WRONG It doesn’t matter if you have $500 in savings or $5 million. Do this now. Top Stock Picker Reveals His Next Potential 500% Winner Stock Prodigy Who Found NIO at $2… Says Buy THIS Now The post Is Dogecoin Dead? Elon Musk and Mark Cuban Say ‘So Much No’ appeared first on InvestorPlace.
InvestorPlace
General Electric Looks Ready to Become a Dividend Grower Once More
General Electric (NYSE:GE) reported Q1 2021 results on Apr. 27. While its adjusted profits were two cents better than analyst estimates, it missed the top-line consensus by $420 million. That news pushed GE stock lower. Source: testing / Shutterstock.com However, despite a mixed quarter, I see a company that looks ready to again become the dividend grower that it was for so many years before — the company General Electric was until it cut its dividend to just a penny back in December 2018. Here’s why I feel this way about GE stock. InvestorPlace - Stock Market News, Stock Advice & Trading Tips GE Stock: Free Cash Flow Is Getting Stronger As any investor worth their salt knows, a company pays its dividends from excess cash. As such, those names that generate healthy cash flow have no problem increasing their dividends from year to year. At the height of its dividend-paying glory in 2008, GE stock paid out $1.24 (split-adjusted) in annual dividends. It’s never been that high since. In that fiscal year, its industrial businesses had cash flow from operating activities of $19.1 billion (Page 75). After subtracting $3 billion in capital expenditures, its industrial business had free cash flow (FCF) of $16.1 billion. In 2020, GE’s four industrial businesses generated FCF of $606 million, down from $2.3 billion in 2019 and $4.8 billion in 2018. 10 of the Top Nasdaq Blue-Chip Stocks to Buy In 2008, its industrial businesses generated almost 27 times as much FCF as they did in 2020. In the first quarter of 2021, the industrial businesses had FCF of -$845 million, 62% higher than a year earlier. That’s still not positive, but considerably better than it was at this point last year. On the results, CEO Larry Culp noted: “I am proud of the GE team’s solid first quarter results, despite a still difficult environment for Aviation. We are improving our cash performance and profitability with Industrial free cash flow growth of $1.7 billion year-over-year.” In the results, the company also reiterated its full-year outlook for 2021, stating that GE Industrial’s FCF will be between $2.5 billion and $4.5 billion. That’s a 313% increase over 2020 at the low end of its FCF estimate and a 643% increase at the high end. To get back to $1.24 in dividends paid out annually, GE would have to generate approximately $10.9 billion (8.8 billion shares outstanding multiplied by $1.24) in FCF to accommodate such a payment. So, clearly, this is not going to happen in 2021 or even 2022. However, it could happen in 2023 if Culp’s plans gain further traction and the company’s FCF continues to strengthen. GE and Its Current Dividends Anyone who’s been a long-term GE stock shareholder must find it difficult to see the current dividend yield at a meager 0.3%. This low yield is part of the price that had to be paid for Culp to accelerate debt repayment. Since the end of 2018, GE has reduced its debt by more than $70 billion. This alone makes Culp’s tenure a success. However, it is the CEO’s decentralization efforts that will determine the company’s future. A lean organization that’s closer to the customer ought to help reignite GE’s growth engine. When you consider the fact that this company’s Power and Renewable Energy segments accounted for about 43% of $16 billion-plus in industrial revenue in Q1, but neither made a profit, the upside is actually quite promising from an overall earnings perspective. If both of these segments had 5% profit margins in Q1 2021, you’re talking about a $358 million profit on $7.1 billion in revenue rather than a $321 million loss. That’s a turnaround of almost $700 million. Based on 8.8 billion shares outstanding, that $700 million equates to about eight cents a share in potential dividends that GE could have paid out. I realize this is only theoretical, but imagine how much GE stock would jump on news that it was increasing its quarterly dividend by 700% — from just a penny to eight cents per share. All I know is this would be significant. The Bottom Line on GE Stock I recently recommended GE stock as one of 10 dividend stocks to buy under $25. Part of my rationale for doing so was GE’s sale of GE Capital Aviation Services (GECAS), the company’s aircraft leasing business, to Aercap (NYSE:AER) for $24 billion in cash and 46% of the combined company. I wrote on Mar. 31: “Culp believes the deleveraging and de-risking of its balance sheet puts the company in a better position to focus on its other operating segments. As stated in the press release for the AerCap sale, the ‘deal marks GE’s transformation to a more focused, simpler, and stronger industrial company.” I agree with that sentiment still. Returning to its roots ought to get GE back in the good graces of dividend investors everywhere in due course. In the meantime, take advantage of any volatility on the downside, buying GE stock in the $12 range or even lower. This time next year, we might not be able to include General Electric in a discussion about dividend stocks to buy under $25. On the date of publication, Will Ashworth did not have (either directly or indirectly) any positions in the securities mentioned in this article. Will Ashworth has written about investments full-time since 2008. Publications where he’s appeared include InvestorPlace, The Motley Fool Canada, Investopedia, Kiplinger, and several others in both the U.S. and Canada. He particularly enjoys creating model portfolios that stand the test of time. He lives in Halifax, Nova Scotia. More From InvestorPlace Why Everyone Is Investing in 5G All WRONG It doesn’t matter if you have $500 in savings or $5 million. Do this now. Top Stock Picker Reveals His Next Potential 500% Winner Stock Prodigy Who Found NIO at $2… Says Buy THIS Now The post General Electric Looks Ready to Become a Dividend Grower Once More appeared first on InvestorPlace.",finance.yahoo.com,"EBS EQUITY ALERT: Kessler Topaz Meltzer & Check, LLP Announces that a Securities Fraud Class Action Lawsuit was filed on Behalf of Investors of Emergent BioSolutions Inc.",,,https://finance.yahoo.com/news/ebs-equity-alert-kessler-topaz-141500943.html,['KO'],"[{'entity_group': 'ORG', 'word': 'National Review American Federation of Teachers Union', 'normalized': 'National Review American Federation of Teachers Union', 'company_key': None, 'start': 0, 'end': 53, 'score': 0.9952698945999141}, {'entity_group': 'ORG', 'word': 'CDC', 'normalized': 'CDC', 'company_key': None, 'start': 65, 'end': 68, 'score': 0.9983712434768671}, {'entity_group': 'ORG', 'word': 'Person', 'normalized': 'Person', 'company_key': None, 'start': 75, 'end': 81, 'score': 0.6910414099693291}, {'entity_group': 'ORG', 'word': 'American Federation of Teachers', 'normalized': 'American Federation of Teachers', 'company_key': None, 'start': 106, 'end': 137, 'score': 0.9991163015365601}, {'entity_group': 'ORG', 'word': 'Centers for Disease Control and Prevention', 'normalized': 'Centers for Disease Control and Prevention', 'company_key': None, 'start': 153, 'end': 195, 'score': 0.999058544635772}, {'entity_group': 'ORG', 'word': 'New York Post', 'normalized': 'New York Post', 'company_key': None, 'start': 276, 'end': 289, 'score': 0.9989081025123591}, {'entity_group': 'ORG', 'word': 'AFT', 'normalized': 'AFT', 'company_key': None, 'start': 349, 'end': 352, 'score': 0.9551486968994141}, {'entity_group': 'ORG', 'word': 'CDC', 'normalized': 'CDC', 'company_key': None, 'start': 404, 'end': 407, 'score': 0.996136784553527}, {'entity_group': 'ORG', 'word': 'Post', 'normalized': 'Post', 'company_key': None, 'start': 426, 'end': 430, 'score': 0.9966165423393251}, {'entity_group': 'ORG', 'word': 'Americans for Public Trust', 'normalized': 'Americans for Public Trust', 'company_key': None, 'start': 479, 'end': 505, 'score': 0.9975035786628721}, {'entity_group': 'MISC', 'word': 'Freedom', 'normalized': 'Freedom', 'company_key': None, 'start': 575, 'end': 582, 'score': 0.499970436096191}, {'entity_group': 'ORG', 'word': 'of Information Act', 'normalized': 'of Information Act', 'company_key': None, 'start': 583, 'end': 601, 'score': 0.8668276667594911}, {'entity_group': 'ORG', 'word': 'CDC', 'normalized': 'CDC', 'company_key': None, 'start': 621, 'end': 624, 'score': 0.9982687234878541}, {'entity_group': 'ORG', 'word': 'AFT', 'normalized': 'AFT', 'company_key': None, 'start': 761, 'end': 764, 'score': 0.9910675883293151}, {'entity_group': 'PER', 'word': 'Kelly Tra', 'normalized': 'Kelly Tra', 'company_key': None, 'start': 799, 'end': 808, 'score': 0.89937400817871}, {'entity_group': 'PER', 'word': '##ner', 'normalized': '##ner', 'company_key': None, 'start': 810, 'end': 813, 'score': 0.7396473288536071}, {'entity_group': 'MISC', 'word': 'SARS', 'normalized': 'SARS', 'company_key': None, 'start': 919, 'end': 923, 'score': 0.977413177490234}, {'entity_group': 'MISC', 'word': 'CoV', 'normalized': 'CoV', 'company_key': None, 'start': 924, 'end': 927, 'score': 0.942118823528289}, {'entity_group': 'MISC', 'word': '2', 'normalized': '2', 'company_key': None, 'start': 928, 'end': 929, 'score': 0.8628327250480651}, {'entity_group': 'PER', 'word': 'Tra', 'normalized': 'Tra', 'company_key': None, 'start': 983, 'end': 986, 'score': 0.7641885280609131}, {'entity_group': 'ORG', 'word': 'CDC', 'normalized': 'CDC', 'company_key': None, 'start': 1049, 'end': 1052, 'score': 0.9964993000030511}, {'entity_group': 'ORG', 'word': 'AFT', 'normalized': 'AFT', 'company_key': None, 'start': 1082, 'end': 1085, 'score': 0.9813405275344841}, {'entity_group': 'ORG', 'word': 'CDC', 'normalized': 'CDC', 'company_key': None, 'start': 1339, 'end': 1342, 'score': 0.9942984580993651}, {'entity_group': 'ORG', 'word': 'CDC', 'normalized': 'CDC', 'company_key': None, 'start': 1417, 'end': 1420, 'score': 0.9978113770484921}, {'entity_group': 'PER', 'word': 'Rand', 'normalized': 'Rand', 'company_key': None, 'start': 1494, 'end': 1498, 'score': 0.9987694621086121}, {'entity_group': 'PER', 'word': '##i Weinga', 'normalized': '##i Weinga', 'company_key': None, 'start': 1498, 'end': 1506, 'score': 0.956706047058105}, {'entity_group': 'ORG', 'word': 'AFT', 'normalized': 'AFT', 'company_key': None, 'start': 1520, 'end': 1523, 'score': 0.9781949520111081}, {'entity_group': 'PER', 'word': 'T', 'normalized': 'T', 'company_key': None, 'start': 1526, 'end': 1527, 'score': 0.9975973963737481}, {'entity_group': 'PER', 'word': '##ra', 'normalized': '##ra', 'company_key': None, 'start': 1527, 'end': 1529, 'score': 0.744592130184173}, {'entity_group': 'ORG', 'word': 'CDC', 'normalized': 'CDC', 'company_key': None, 'start': 1797, 'end': 1800, 'score': 0.978467762470245}, {'entity_group': 'PER', 'word': 'Rachel', 'normalized': 'Rachel', 'company_key': None, 'start': 1814, 'end': 1820, 'score': 0.928011298179626}, {'entity_group': 'ORG', 'word': 'White House', 'normalized': 'White House', 'company_key': None, 'start': 1833, 'end': 1844, 'score': 0.8241941332817071}, {'entity_group': 'PER', 'word': 'Carol', 'normalized': 'Carol', 'company_key': None, 'start': 1877, 'end': 1882, 'score': 0.585629165172576}, {'entity_group': 'ORG', 'word': 'CDC', 'normalized': 'CDC', 'company_key': None, 'start': 1896, 'end': 1899, 'score': 0.96577763557434}, {'entity_group': 'ORG', 'word': 'Post', 'normalized': 'Post', 'company_key': None, 'start': 1982, 'end': 1986, 'score': 0.9425073862075801}, {'entity_group': 'ORG', 'word': 'Natural', 'normalized': 'Natural', 'company_key': None, 'start': 1989, 'end': 1996, 'score': 0.841935276985168}, {'entity_group': 'ORG', 'word': 'CDC', 'normalized': 'CDC', 'company_key': None, 'start': 2125, 'end': 2128, 'score': 0.9660480618476861}, {'entity_group': 'ORG', 'word': 'Or', 'normalized': 'Or', 'company_key': None, 'start': 2147, 'end': 2149, 'score': 0.753789484500885}, {'entity_group': 'ORG', 'word': 'Ko', 'normalized': 'KO', 'company_key': 'KO', 'start': 2154, 'end': 2156, 'score': 0.7335013151168821}, {'entity_group': 'ORG', 'word': 'Trump', 'normalized': 'Trump', 'company_key': None, 'start': 2224, 'end': 2229, 'score': 0.7802105545997621}, {'entity_group': 'ORG', 'word': 'B', 'normalized': 'B', 'company_key': None, 'start': 2250, 'end': 2251, 'score': 0.888061046600341}, {'entity_group': 'ORG', 'word': 'Re', 'normalized': 'Re', 'company_key': None, 'start': 2365, 'end': 2367, 'score': 0.840633630752563}]","{'negative': 0.000339916819939, 'neutral': 0.998467743396759, 'positive': 0.001192337134853}","{'neutral': 0.9470186829566951, 'anger': 0.018857706338167, 'surprise': 0.011500029824674001, 'disgust': 0.009296204894781, 'sadness': 0.004755727015435, 'joy': 0.004460589028894, 'fear': 0.004111080430448001}",2021/ecc6f83dff6ba03527b0fbf6540dbd77953d7ee64a4775e1137267bf41290a0e.json,5
