authors,date_download,date_modify,date_publish,description,filename,image_url,language,localpath,maintext,source_domain,title,title_page,title_rss,url,mentioned_companies,named_entities,sentiment,emotion,file_id,month_publish
['Mark Gurman'],2023-06-01 00:19:40+00:00,,2023-05-31 22:48:41,"(Bloomberg) -- Apple Inc. is testing a pair of new high-end Macs and their accompanying processors ahead of its Worldwide Developers Conference next week, suggesting that it’s nearing the release of professional-focused desktop computers.Most Read from BloombergChina Is Drilling a 10,000-Meter-Deep Hole Into Earth’s CrustS&P 500 Almost Wipes Out Its Monthly Advance: Markets WrapHedge Funds Are Deploying ChatGPT to Handle All the Grunt WorkTwitter Is Now Worth Just 33% of Elon Musk’s Purchase Pri",https%3A%2F%2Ffinance.yahoo.com%2Fnews%2Fapple-tests-high-end-macs-224841771.html.json,https://s.yimg.com/ny/api/res/1.2/qutFZlRVLQNUadi4bIY9bA--/YXBwaWQ9aGlnaGxhbmRlcjt3PTEyMDA7aD04MDA-/https://media.zenfs.com/en/bloomberg_technology_68/6cf549117944583bdaa22206638da487,en,,"(Bloomberg) -- Apple Inc. is testing a pair of new high-end Macs and their accompanying processors ahead of its Worldwide Developers Conference next week, suggesting that it’s nearing the release of professional-focused desktop computers.
Most Read from Bloomberg
China Is Drilling a 10,000-Meter-Deep Hole Into Earth’s Crust
S&P 500 Almost Wipes Out Its Monthly Advance: Markets Wrap
Hedge Funds Are Deploying ChatGPT to Handle All the Grunt Work
Twitter Is Now Worth Just 33% of Elon Musk’s Purchase Price, Fidelity Says
Debt-Limit Deal Heads to House Vote After Clearing Key Hurdle
The company is planning two new Mac models — labeled internally as Mac 14,13 and Mac 14,14 — that run the M2 Max processor announced in January and a yet-to-be-unveiled M2 Ultra chip. That second processor would replace the M1 Ultra model currently featured in the Mac Studio, a high-end desktop announced in March 2022.
The new computers are part of an effort to overhaul the Mac line and attract consumers during a sluggish stretch for the computer industry. Powerful desktop models remain key to Apple’s appeal among professional users, such as video editors or graphic designers. The company also is just days away from WWDC, its annual gathering of developers who rely on such machines to build apps.
A representative for Cupertino, California-based Apple declined to comment.
The first desktop computer in testing is running an M2 Max processor with eight high-performance cores — components for the most demanding tasks — as well as four efficiency cores and 30 graphics cores. Those are the same specifications featured in the MacBook Pro with the M2 Max. This particular machine also includes 96 gigabytes of memory and is running macOS 13.4, the version of the Mac operating system that was just released earlier this month.
The second machine in testing has what is labeled as an M2 Ultra chip, which the company’s hasn’t yet announced. That component, which sports 24 processing cores, doubles the performance of the M2 Max model. The chip includes 16 high-performance cores and eight efficiency cores, as well as 60 graphics cores. The company is testing it in configurations with 64 gigabytes, 128 gigabytes and 192 gigabytes of memory.
The M2 Ultra chip will also include a more powerful option, with as many as 76 graphics cores, doubling the 38-core maximum found in the current M2 Max chip, Bloomberg has reported.
The M2 Ultra chip was initially designed for a future version of the high-end Mac Pro desktop. That machine currently still runs Intel Corp. chips — a holdout in Apple’s three-year effort to use homegrown processors in its computers.
Apple has been vague about when a new Mac Pro is coming. It said more than a year ago that an updated model would arrive “another day.” Inside Apple, the future Mac Pro with in-house chips has been labeled Mac 14,8. That suggests that the latest desktops in testing are different machines, such as new versions of the Mac Studio, which is currently offered in M1 Max and M1 Ultra configurations.
Bloomberg reported in April that two new Mac Studio updates are in the works. Apple has also been developing a 15-inch version of the MacBook Air, along with future iterations of the 13-inch MacBook Air and 15-inch model with a 3-nanometer M3 processor. And it’s planning a low-end 13-inch MacBook Pro and an iMac with the next-generation chip.
Next week’s developer expo kicks off Monday with the debut of Apple’s much-anticipated mixed-reality headset. The company also will unveil updates to the software that runs on the iPhone, iPad, Apple Watch and Mac. The presentation will include multiple new Mac models as well.
In another sign that new machines are coming soon, Apple is planning to start letting customers trade in more types of Macs for a gift card next Monday. The Macs that Apple will begin accepting: the M2 13-inch MacBook Air and 13-inch MacBook Pro, as well as the current Mac Studio. Such a move typically heralds that new versions are on the way.
Most Read from Bloomberg Businessweek
Assault Allegations Plague a $1.4 Billion Home Eldercare Startup
Republicans Hail Big Spending Cuts That Economists Say Will Have Little Impact on the Economy
Opioid Crisis Spurred by Animal Sedative’s Stealth Emergence
Sergey Brin Has a Secret Plan to Put Airships Back in the Skies
Adidas After Yeezy
©2023 Bloomberg L.P.",finance.yahoo.com,Apple Tests New High-End Macs With M2 Max and M2 Ultra Chips Ahead of WWDC,,,https://finance.yahoo.com/news/apple-tests-high-end-macs-224841771.html,['AAPL'],"[{'entity_group': 'ORG', 'word': 'Apple Inc', 'normalized': 'AAPL', 'company_key': 'AAPL', 'start': 15, 'end': 24, 'score': 0.999208092689514}, {'entity_group': 'MISC', 'word': 'Mac', 'normalized': 'Mac', 'company_key': None, 'start': 60, 'end': 63, 'score': 0.9912286996841431}, {'entity_group': 'MISC', 'word': 'Worldwide Developers Conference', 'normalized': 'Worldwide Developers Conference', 'company_key': None, 'start': 112, 'end': 143, 'score': 0.878846764564514}, {'entity_group': 'ORG', 'word': 'Bloomberg China', 'normalized': 'Bloomberg China', 'company_key': None, 'start': 254, 'end': 269, 'score': 0.8541151285171501}, {'entity_group': 'MISC', 'word': 'Hole', 'normalized': 'Hole', 'company_key': None, 'start': 302, 'end': 306, 'score': 0.5962509512901301}, {'entity_group': 'MISC', 'word': 'Earth', 'normalized': 'Earth', 'company_key': None, 'start': 312, 'end': 317, 'score': 0.42480537295341403}, {'entity_group': 'MISC', 'word': 'Crust', 'normalized': 'Crust', 'company_key': None, 'start': 320, 'end': 325, 'score': 0.67491614818573}, {'entity_group': 'ORG', 'word': 'S', 'normalized': 'S', 'company_key': None, 'start': 326, 'end': 327, 'score': 0.893548011779785}, {'entity_group': 'MISC', 'word': '& P', 'normalized': '& P', 'company_key': None, 'start': 327, 'end': 329, 'score': 0.7446632385253901}, {'entity_group': 'ORG', 'word': 'Elon Musk', 'normalized': 'Elon Musk', 'company_key': None, 'start': 481, 'end': 490, 'score': 0.9915924072265621}, {'entity_group': 'MISC', 'word': 'Mac', 'normalized': 'Mac', 'company_key': None, 'start': 617, 'end': 620, 'score': 0.9964660406112671}, {'entity_group': 'MISC', 'word': 'Mac', 'normalized': 'Mac', 'company_key': None, 'start': 652, 'end': 655, 'score': 0.9881602525711061}, {'entity_group': 'MISC', 'word': 'Mac', 'normalized': 'Mac', 'company_key': None, 'start': 666, 'end': 669, 'score': 0.973684310913085}, {'entity_group': 'MISC', 'word': 'Max', 'normalized': 'Max', 'company_key': None, 'start': 694, 'end': 697, 'score': 0.9741076827049251}, {'entity_group': 'MISC', 'word': 'Ultra', 'normalized': 'Ultra', 'company_key': None, 'start': 757, 'end': 762, 'score': 0.450741320848464}, {'entity_group': 'MISC', 'word': 'M1 Ultra', 'normalized': 'M1 Ultra', 'company_key': None, 'start': 809, 'end': 817, 'score': 0.8202880620956421}, {'entity_group': 'MISC', 'word': 'Mac Studio', 'normalized': 'Mac Studio', 'company_key': None, 'start': 850, 'end': 860, 'score': 0.981907367706298}, {'entity_group': 'MISC', 'word': 'Mac', 'normalized': 'Mac', 'company_key': None, 'start': 962, 'end': 965, 'score': 0.9936191439628601}, {'entity_group': 'ORG', 'word': 'Apple', 'normalized': 'AAPL', 'company_key': 'AAPL', 'start': 1084, 'end': 1089, 'score': 0.998203992843627}, {'entity_group': 'ORG', 'word': 'WWDC', 'normalized': 'WWDC', 'company_key': None, 'start': 1209, 'end': 1213, 'score': 0.864146173000335}, {'entity_group': 'LOC', 'word': 'Cupert', 'normalized': 'Cupert', 'company_key': None, 'start': 1312, 'end': 1318, 'score': 0.532065629959106}, {'entity_group': 'MISC', 'word': '##ino', 'normalized': '##ino', 'company_key': None, 'start': 1318, 'end': 1321, 'score': 0.9693395495414731}, {'entity_group': 'MISC', 'word': 'California', 'normalized': 'California', 'company_key': None, 'start': 1323, 'end': 1333, 'score': 0.9864869117736811}, {'entity_group': 'ORG', 'word': 'Apple', 'normalized': 'AAPL', 'company_key': 'AAPL', 'start': 1340, 'end': 1345, 'score': 0.998994529247283}, {'entity_group': 'MISC', 'word': 'Max', 'normalized': 'Max', 'company_key': None, 'start': 1422, 'end': 1425, 'score': 0.9584988951683041}, {'entity_group': 'MISC', 'word': 'MacBook Pro', 'normalized': 'MacBook Pro', 'company_key': None, 'start': 1620, 'end': 1631, 'score': 0.997530043125152}, {'entity_group': 'MISC', 'word': 'Mac', 'normalized': 'Mac', 'company_key': None, 'start': 1756, 'end': 1759, 'score': 0.823934674263}]","{'negative': 0.000150465479237, 'neutral': 0.99184238910675, 'positive': 0.008007154799997}","{'neutral': 0.8838174343109131, 'surprise': 0.078193865716457, 'sadness': 0.010814736597239001, 'anger': 0.008301473222672, 'disgust': 0.0070346961729220005, 'joy': 0.005999366287142, 'fear': 0.005838504061102001}",2023/a5781353e1c391d3327474f2fea8ce49088a86bbad43dc6562cdaa9cfcbda3ed.json,5
