authors,date_download,date_modify,date_publish,description,filename,image_url,language,localpath,maintext,source_domain,title,title_page,title_rss,url,mentioned_companies,named_entities,sentiment,emotion,file_id,month_publish
[],2023-06-01 01:50:53+00:00,,2023-05-31 23:56:20,"SHANGHAI (Reuters) -Elon Musk's private jet is scheduled to leave Shanghai on Thursday morning and head to Austin, Texas, data from flight tracking provider Variflight showed, wrapping up a whirlwind trip to China - his first in three years. After two days in Beijing, the Tesla Inc CEO arrived in Shanghai on Wednesday night and visited the U.S. electric vehicle maker's plant in the financial hub, showed photos posted by Tesla's China-based public affairs chief Grace Tao on her Weibo account.",https%3A%2F%2Ffinance.yahoo.com%2Fnews%2Felon-musks-private-jet-scheduled-235620043.html.json,https://media.zenfs.com/en/reuters-finance.com/62c07f69bc1c0c72726f922438212acc,en,,"SHANGHAI (Reuters) -Elon Musk's private jet is scheduled to leave Shanghai on Thursday morning and head to Austin, Texas, data from flight tracking provider Variflight showed, wrapping up a whirlwind trip to China - his first in three years.
After two days in Beijing, the Tesla Inc CEO arrived in Shanghai on Wednesday night and visited the U.S. electric vehicle maker's plant in the financial hub, showed photos posted by Tesla's China-based public affairs chief Grace Tao on her Weibo account.
Tesla did not respond to a request for comment on Musk's planned departure.
The photos showed Musk holding up a ""Giga Shanghai"" sign, flanked by hundreds of staff including Tao and head of global manufacturing Tom Zhu.
""A very rewarding day!,"" Tao said alongside her post.
Since his arrival in China on Tuesday morning, the U.S. billionaire has been showered with praise from the Chinese public. He also had meetings with three government ministers and battery supplier Contemporary Amperex Technology Co Ltd (CATL).
(Reporting by Brenda Goh and Zhang Yan; Editing by Tom Hogue and Christopher Cushing)",finance.yahoo.com,Elon Musk's private jet scheduled to leave China on Thursday -flight tracking data,,,https://finance.yahoo.com/news/elon-musks-private-jet-scheduled-235620043.html,['TSLA'],"[{'entity_group': 'ORG', 'word': '##ANG', 'normalized': '##ANG', 'company_key': None, 'start': 2, 'end': 5, 'score': 0.631510138511657}, {'entity_group': 'ORG', 'word': 'Reuters', 'normalized': 'Reuters', 'company_key': None, 'start': 10, 'end': 17, 'score': 0.998176217079162}, {'entity_group': 'ORG', 'word': 'Elon Musk', 'normalized': 'Elon Musk', 'company_key': None, 'start': 20, 'end': 29, 'score': 0.98417192697525}, {'entity_group': 'LOC', 'word': 'Shanghai', 'normalized': 'Shanghai', 'company_key': None, 'start': 66, 'end': 74, 'score': 0.999604761600494}, {'entity_group': 'LOC', 'word': 'Austin', 'normalized': 'Austin', 'company_key': None, 'start': 107, 'end': 113, 'score': 0.999338567256927}, {'entity_group': 'LOC', 'word': 'Texas', 'normalized': 'Texas', 'company_key': None, 'start': 115, 'end': 120, 'score': 0.9995463490486141}, {'entity_group': 'ORG', 'word': 'Variflight', 'normalized': 'Variflight', 'company_key': None, 'start': 157, 'end': 167, 'score': 0.9898165464401241}, {'entity_group': 'LOC', 'word': 'China', 'normalized': 'China', 'company_key': None, 'start': 208, 'end': 213, 'score': 0.9997168183326721}, {'entity_group': 'LOC', 'word': 'Beijing', 'normalized': 'Beijing', 'company_key': None, 'start': 260, 'end': 267, 'score': 0.9997518658638}, {'entity_group': 'ORG', 'word': 'Tesla Inc', 'normalized': 'Tesla Inc', 'company_key': None, 'start': 273, 'end': 282, 'score': 0.9972907900810241}, {'entity_group': 'LOC', 'word': 'Shanghai', 'normalized': 'Shanghai', 'company_key': None, 'start': 298, 'end': 306, 'score': 0.999644041061401}, {'entity_group': 'LOC', 'word': 'U. S', 'normalized': 'U. S', 'company_key': None, 'start': 342, 'end': 345, 'score': 0.9974036812782281}, {'entity_group': 'ORG', 'word': 'Tesla', 'normalized': 'TSLA', 'company_key': 'TSLA', 'start': 424, 'end': 429, 'score': 0.997452497482299}, {'entity_group': 'MISC', 'word': 'China', 'normalized': 'China', 'company_key': None, 'start': 432, 'end': 437, 'score': 0.9600757360458371}, {'entity_group': 'PER', 'word': 'Grace Tao', 'normalized': 'Grace Tao', 'company_key': None, 'start': 465, 'end': 474, 'score': 0.9994673728942871}, {'entity_group': 'ORG', 'word': 'Weibo', 'normalized': 'Weibo', 'company_key': None, 'start': 482, 'end': 487, 'score': 0.9915142059326171}, {'entity_group': 'ORG', 'word': 'Tesla', 'normalized': 'TSLA', 'company_key': 'TSLA', 'start': 497, 'end': 502, 'score': 0.9957810640335081}, {'entity_group': 'PER', 'word': 'Mu', 'normalized': 'Mu', 'company_key': None, 'start': 547, 'end': 549, 'score': 0.795742809772491}, {'entity_group': 'ORG', 'word': '##sk', 'normalized': '##sk', 'company_key': None, 'start': 549, 'end': 551, 'score': 0.412875831127166}, {'entity_group': 'PER', 'word': 'Mu', 'normalized': 'Mu', 'company_key': None, 'start': 591, 'end': 593, 'score': 0.880478084087371}, {'entity_group': 'ORG', 'word': '##sk', 'normalized': '##sk', 'company_key': None, 'start': 593, 'end': 595, 'score': 0.311806410551071}, {'entity_group': 'MISC', 'word': 'Giga Shanghai', 'normalized': 'Giga Shanghai', 'company_key': None, 'start': 610, 'end': 623, 'score': 0.91733831167221}, {'entity_group': 'PER', 'word': 'Tao', 'normalized': 'Tao', 'company_key': None, 'start': 670, 'end': 673, 'score': 0.9908927679061891}, {'entity_group': 'PER', 'word': 'Tom Zhu', 'normalized': 'Tom Zhu', 'company_key': None, 'start': 707, 'end': 714, 'score': 0.9994323253631591}, {'entity_group': 'PER', 'word': 'Tao', 'normalized': 'Tao', 'company_key': None, 'start': 741, 'end': 744, 'score': 0.9918295741081231}, {'entity_group': 'LOC', 'word': 'China', 'normalized': 'China', 'company_key': None, 'start': 791, 'end': 796, 'score': 0.9997501969337461}, {'entity_group': 'LOC', 'word': 'U. S', 'normalized': 'U. S', 'company_key': None, 'start': 821, 'end': 824, 'score': 0.923361122608184}, {'entity_group': 'MISC', 'word': 'Chinese', 'normalized': 'Chinese', 'company_key': None, 'start': 877, 'end': 884, 'score': 0.9987711310386651}, {'entity_group': 'ORG', 'word': 'Contemporary Amperex Technology Co Ltd', 'normalized': 'Contemporary Amperex Technology Co Ltd', 'company_key': None, 'start': 967, 'end': 1005, 'score': 0.997637867927551}, {'entity_group': 'ORG', 'word': 'CATL', 'normalized': 'CATL', 'company_key': None, 'start': 1007, 'end': 1011, 'score': 0.992316782474517}, {'entity_group': 'PER', 'word': 'Brenda Goh', 'normalized': 'Brenda Goh', 'company_key': None, 'start': 1028, 'end': 1038, 'score': 0.9899485707283021}, {'entity_group': 'PER', 'word': 'Zhang Yan', 'normalized': 'Zhang Yan', 'company_key': None, 'start': 1043, 'end': 1052, 'score': 0.999288439750671}, {'entity_group': 'PER', 'word': 'Tom Hogue', 'normalized': 'Tom Hogue', 'company_key': None, 'start': 1065, 'end': 1074, 'score': 0.9955956339836121}, {'entity_group': 'PER', 'word': 'Christopher Cushing', 'normalized': 'Christopher Cushing', 'company_key': None, 'start': 1079, 'end': 1098, 'score': 0.9991867542266841}]","{'negative': 0.0008460169192400001, 'neutral': 0.03756621107459, 'positive': 0.9615878462791441}","{'joy': 0.5590552091598511, 'neutral': 0.346211731433868, 'surprise': 0.07261466234922401, 'sadness': 0.008496037684381001, 'anger': 0.005020738579332, 'fear': 0.004940403625369, 'disgust': 0.003661127062514}",2023/34201648fba2841c3d191b56e099fd7428cfaea1d24b054aafea41dd87fd573b.json,5
['Mark Gurman'],2023-06-01 03:43:48+00:00,,2023-05-31 18:15:33,"(Bloomberg) -- Apple Inc., touting the value of its App Store just ahead of the company’s developer expo, said that the platform handled transactions worth $1.1 trillion last year, up 29% from 2021.A study from Analysis Group that was commissioned by Apple found that annual sales and billings — which include money from apps and subscriptions, in-app advertising and physical goods or services — climbed more than 80% on the App Store since 2019. The latest annual increase was an uptick from growth",https%3A%2F%2Ffinance.yahoo.com%2Fnews%2Fapple-app-commerce-climbed-29-181533864.html.json,https://s.yimg.com/ny/api/res/1.2/CDYIbLvlL278Diwfe9wN0A--/YXBwaWQ9aGlnaGxhbmRlcjt3PTEyMDA7aD03MTM-/https://media.zenfs.com/en/bloomberg_technology_68/da502ca5380b3b017a5da5639d503137,en,,"(Bloomberg) -- Apple Inc., touting the value of its App Store just ahead of the company’s developer expo, said that the platform handled transactions worth $1.1 trillion last year, up 29% from 2021.
A study from Analysis Group that was commissioned by Apple found that annual sales and billings — which include money from apps and subscriptions, in-app advertising and physical goods or services — climbed more than 80% on the App Store since 2019. The latest annual increase was an uptick from growth of 27% in 2021 and 2020.
Apple is facing criticism that it wields too much power over the App Store by putting restrictions on developers and charging them a commission of as much as 30%. In citing the report, the iPhone maker is looking to address those concerns by showing how much money it’s making for developers. The company said that 90% of the $1.1 trillion went entirely to businesses rather than commissions to Apple.
“As this report shows, the App Store is a vibrant, innovative marketplace where opportunity thrives,” Chief Executive Officer Tim Cook said in a statement.
Cook will speak to Apple developers next week at the company’s annual Worldwide Developers Conference, where he’s expected to unveil a mixed-reality headset that will have its own App Store. The device represents Apple’s first major new product category since 2015, and the company will need the support of third-party app developers to make it a success.
According to the Analysis Group report, the biggest driver of App Store commerce last year was general retail, followed by travel. Food delivery and pickup apps generated about $77 billion in 2022, while ride-sharing services made roughly $48 billion. In-app advertising grew to $109 billion from $45 billion in 2019, the report found.
Apple’s App Store commission applies to digital goods, not physical items and services sold through apps.
(Updated with more details on $1.1 trillion figure in third paragraph.)
Most Read from Bloomberg Businessweek
Assault Allegations Plague a $1.4 Billion Home Eldercare Startup
Republicans Hail Big Spending Cuts That Economists Say Will Have Little Impact on the Economy
Opioid Crisis Spurred by Animal Sedative’s Stealth Emergence
Sergey Brin Has a Secret Plan to Put Airships Back in the Skies
Adidas After Yeezy
©2023 Bloomberg L.P.",finance.yahoo.com,Apple App Commerce Climbed 29% Last Year to $1.1 Trillion,,,https://finance.yahoo.com/news/apple-app-commerce-climbed-29-181533864.html,['AAPL'],"[{'entity_group': 'ORG', 'word': 'Apple Inc', 'normalized': 'AAPL', 'company_key': 'AAPL', 'start': 15, 'end': 24, 'score': 0.9993422031402581}, {'entity_group': 'ORG', 'word': 'A', 'normalized': 'A', 'company_key': None, 'start': 52, 'end': 53, 'score': 0.9278464913368221}, {'entity_group': 'ORG', 'word': '##pp Store', 'normalized': '##pp Store', 'company_key': None, 'start': 53, 'end': 61, 'score': 0.5954489707946771}, {'entity_group': 'ORG', 'word': 'Analysis Group', 'normalized': 'Analysis Group', 'company_key': None, 'start': 212, 'end': 226, 'score': 0.9992431402206421}, {'entity_group': 'ORG', 'word': 'Apple', 'normalized': 'AAPL', 'company_key': 'AAPL', 'start': 252, 'end': 257, 'score': 0.9984518289566041}, {'entity_group': 'ORG', 'word': 'A', 'normalized': 'A', 'company_key': None, 'start': 427, 'end': 428, 'score': 0.8407456874847411}, {'entity_group': 'ORG', 'word': '##pp', 'normalized': '##pp', 'company_key': None, 'start': 428, 'end': 430, 'score': 0.5876367688179011}, {'entity_group': 'MISC', 'word': 'Store', 'normalized': 'Store', 'company_key': None, 'start': 431, 'end': 436, 'score': 0.8012917041778561}, {'entity_group': 'ORG', 'word': 'Apple', 'normalized': 'AAPL', 'company_key': 'AAPL', 'start': 527, 'end': 532, 'score': 0.9988098144531251}, {'entity_group': 'ORG', 'word': 'A', 'normalized': 'A', 'company_key': None, 'start': 592, 'end': 593, 'score': 0.9343507885932921}, {'entity_group': 'ORG', 'word': '##pp', 'normalized': '##pp', 'company_key': None, 'start': 593, 'end': 595, 'score': 0.782769441604614}, {'entity_group': 'MISC', 'word': 'Store', 'normalized': 'Store', 'company_key': None, 'start': 596, 'end': 601, 'score': 0.5514928102493281}, {'entity_group': 'MISC', 'word': 'iPhone', 'normalized': 'iPhone', 'company_key': None, 'start': 716, 'end': 722, 'score': 0.8343874812126161}, {'entity_group': 'ORG', 'word': 'Apple', 'normalized': 'AAPL', 'company_key': 'AAPL', 'start': 922, 'end': 927, 'score': 0.997435390949249}, {'entity_group': 'ORG', 'word': 'A', 'normalized': 'A', 'company_key': None, 'start': 956, 'end': 957, 'score': 0.8081952929496761}, {'entity_group': 'ORG', 'word': '##pp', 'normalized': '##pp', 'company_key': None, 'start': 957, 'end': 959, 'score': 0.6386752724647521}, {'entity_group': 'MISC', 'word': 'Store', 'normalized': 'Store', 'company_key': None, 'start': 960, 'end': 965, 'score': 0.658013522624969}, {'entity_group': 'PER', 'word': 'Tim Cook', 'normalized': 'Tim Cook', 'company_key': None, 'start': 1055, 'end': 1063, 'score': 0.999694228172302}, {'entity_group': 'PER', 'word': 'Cook', 'normalized': 'Cook', 'company_key': None, 'start': 1085, 'end': 1089, 'score': 0.987573027610778}, {'entity_group': 'ORG', 'word': 'Apple', 'normalized': 'AAPL', 'company_key': 'AAPL', 'start': 1104, 'end': 1109, 'score': 0.9971098303794861}, {'entity_group': 'MISC', 'word': 'Worldwide Developers Conference', 'normalized': 'Worldwide Developers Conference', 'company_key': None, 'start': 1155, 'end': 1186, 'score': 0.9280425906181331}, {'entity_group': 'ORG', 'word': '##pp', 'normalized': '##pp', 'company_key': None, 'start': 1266, 'end': 1268, 'score': 0.435570150613784}, {'entity_group': 'MISC', 'word': 'Store', 'normalized': 'Store', 'company_key': None, 'start': 1269, 'end': 1274, 'score': 0.648713707923889}, {'entity_group': 'ORG', 'word': 'Apple', 'normalized': 'AAPL', 'company_key': 'AAPL', 'start': 1298, 'end': 1303, 'score': 0.9982579350471491}, {'entity_group': 'ORG', 'word': 'Analysis Group', 'normalized': 'Analysis Group', 'company_key': None, 'start': 1458, 'end': 1472, 'score': 0.9990119934082031}, {'entity_group': 'ORG', 'word': 'A', 'normalized': 'A', 'company_key': None, 'start': 1503, 'end': 1504, 'score': 0.513355910778045}, {'entity_group': 'ORG', 'word': '##pp', 'normalized': '##pp', 'company_key': None, 'start': 1504, 'end': 1506, 'score': 0.5380530953407281}, {'entity_group': 'MISC', 'word': 'Store', 'normalized': 'Store', 'company_key': None, 'start': 1507, 'end': 1512, 'score': 0.9689883589744561}, {'entity_group': 'ORG', 'word': 'Apple', 'normalized': 'AAPL', 'company_key': 'AAPL', 'start': 1777, 'end': 1782, 'score': 0.9805023074150081}, {'entity_group': 'MISC', 'word': 'Store', 'normalized': 'Store', 'company_key': None, 'start': 1789, 'end': 1794, 'score': 0.6470733880996701}, {'entity_group': 'MISC', 'word': '##idas', 'normalized': '##idas', 'company_key': None, 'start': 2279, 'end': 2283, 'score': 0.519786536693573}]","{'negative': 0.00021706146071600002, 'neutral': 8.294120925711469e-05, 'positive': 0.9997000694274901}","{'neutral': 0.8385705947875971, 'surprise': 0.06517664343118601, 'anger': 0.046389501541852, 'joy': 0.022458383813500002, 'disgust': 0.01192850805819, 'fear': 0.008726246654987, 'sadness': 0.006750162225216001}",2023/0da7006fa9df75a973149140d1560d9b64fcc185bfc0630a27c2e0c593a5604a.json,5
['Clare Duffy'],2023-06-01 00:19:34+00:00,,2023-05-31 22:41:56,Amazon has agreed to pay more than $30 million to settle two federal lawsuits alleging that the tech giant violated users’ privacy — including that of children — through its Alexa voice assistant and its Ring doorbell cameras.,https%3A%2F%2Ffinance.yahoo.com%2Fnews%2Famazon-ring-pay-5-8-191117799.html.json,https://media.zenfs.com/en/cnn_business_articles_218/dc02e1160023aa1c243f2cb67a39254c,en,,"Amazon has agreed to pay more than $30 million to settle two federal lawsuits alleging that the tech giant violated users’ privacy — including that of children — through its Alexa voice assistant and its Ring doorbell cameras.
The twin settlements Wednesday with the Federal Trade Commission highlight claims that Amazon retained Ring videos and Alexa voice recordings, along with related geolocation information, for years – in some cases without consent and despite requests by consumers for the data to be deleted.
In addition, the FTC alleged that lax data policies at Amazon meant that the information could often be accessed by unauthorized parties — and often was, in the case of Ring doorbell footage.
“While we disagree with the FTC’s claims regarding both Alexa and Ring, and deny violating the law, these settlements put these matters behind us,” Amazon said in a statement Wednesday.
Amazon acquired Ring in 2018, paving the way for the e-commerce giant to get into the home security business. In addition to video doorbells, Ring makes indoor and outdoor security cameras as well as alarm systems.
In a complaint accompanying the settlement, the FTC claimed Ring gave employees unrestricted access to videos from customers’ home security systems. In one instance, the complaint states, a Ring employee viewed thousands of video recordings from at least 81 female users between June and August 2017, viewing cameras that users had assigned to bathrooms and bedrooms. An initial misconduct report by a fellow employee was not taken seriously, the complaint said.
“Only after the supervisor noticed that the male employee was only viewing videos of ‘pretty girls’ did the supervisor escalate the report of misconduct,” the FTC alleged in the complaint. “Only at that point did Ring review a portion of the employee’s activity and, ultimately, terminate his employment.”
The complaint against Ring also recounts numerous alleged instances of hacked cameras allowing malicious actors to speak to victims, causing distress. Many of these attacks allegedly occurred through successful guessing of user passwords, reflecting failures by Amazon to require strong password protections, according to the complaint.
“Between January 2019 and March 2020, more than 55,000 U.S. customers suffered from credential stuffing and brute force attacks that compromised Ring devices,” the FTC alleged. “Through these attacks, bad actors gained access to hundreds of thousands of videos of the personal spaces of consumers’ homes, including their bedrooms and their children’s bedrooms—recorded by devices that Ring sold by claiming that they would increase consumers’ security.”
Ring has agreed to pay $5.8 million and implement a new data security program, according to the proposed settlement.
In its statement, Amazon said: “Ring promptly addressed the issues at hand on its own years ago, well before the FTC began its inquiry.”
“Ring promptly addressed these issues on its own years ago, well before the FTC began its inquiry,” Ring said in a statement provided to CNN. “While we disagree with the FTC’s allegations and deny violating the law, this settlement resolves this matter so we can focus on innovating on behalf of our customers.”
Separately, Amazon will pay $25 million to settle the allegations surrounding its Alexa voice assistant.
In a complaint, the FTC alleged that Amazon violated a children’s privacy law known as COPPA, which restricts the collection of personal information from children under 13 without a parent’s consent.
According to the FTC, Amazon kept Alexa voice recordings of children “indefinitely” unless a user specifically instructed the company to delete the recordings. It also allegedly sometimes failed to honor the deletion requests “and instead retained that data for its own potential use.”
The proposed Alexa settlement requires Amazon to delete voice recordings and geolocation data in accordance with past consumer requests, including that of children. The company will also be barred from using that data to train its algorithms, the FTC said. Amazon also agreed to send consumers notices about the FTC settlement, and to implement a privacy program for geolocation data.
“We built Alexa with strong privacy protections and customer controls, designed Amazon Kids to comply with COPPA, and collaborated with the FTC before expanding Amazon Kids to include Alexa,” the company said in the statement. “As part of the settlement, we agreed to make a small modification to our already strong practices, and will remove child profiles that have been inactive for more than 18 months unless a parent or guardian chooses to keep them.”",finance.yahoo.com,Amazon to pay more than $30 million to settle FTC privacy complaints over Alexa and Ring,,,https://finance.yahoo.com/news/amazon-ring-pay-5-8-191117799.html,['AMZN'],"[{'entity_group': 'ORG', 'word': 'Amazon', 'normalized': 'AMZN', 'company_key': 'AMZN', 'start': 0, 'end': 6, 'score': 0.9969316720962521}, {'entity_group': 'ORG', 'word': 'Alexa', 'normalized': 'Alexa', 'company_key': None, 'start': 174, 'end': 179, 'score': 0.786137878894805}, {'entity_group': 'ORG', 'word': 'Ring', 'normalized': 'Ring', 'company_key': None, 'start': 204, 'end': 208, 'score': 0.8918487429618831}, {'entity_group': 'ORG', 'word': 'Federal Trade Commission', 'normalized': 'Federal Trade Commission', 'company_key': None, 'start': 267, 'end': 291, 'score': 0.9992153048515321}, {'entity_group': 'ORG', 'word': 'Amazon', 'normalized': 'AMZN', 'company_key': 'AMZN', 'start': 314, 'end': 320, 'score': 0.9909430146217341}, {'entity_group': 'ORG', 'word': 'Ring', 'normalized': 'Ring', 'company_key': None, 'start': 330, 'end': 334, 'score': 0.508941829204559}, {'entity_group': 'ORG', 'word': 'Alex', 'normalized': 'Alex', 'company_key': None, 'start': 346, 'end': 350, 'score': 0.788406789302825}, {'entity_group': 'ORG', 'word': 'FTC', 'normalized': 'FTC', 'company_key': None, 'start': 535, 'end': 538, 'score': 0.9972973465919491}, {'entity_group': 'ORG', 'word': 'Amazon', 'normalized': 'AMZN', 'company_key': 'AMZN', 'start': 573, 'end': 579, 'score': 0.911295294761657}, {'entity_group': 'ORG', 'word': 'Ring', 'normalized': 'Ring', 'company_key': None, 'start': 687, 'end': 691, 'score': 0.7623763680458061}, {'entity_group': 'ORG', 'word': 'FTC', 'normalized': 'FTC', 'company_key': None, 'start': 738, 'end': 741, 'score': 0.9978746175765991}, {'entity_group': 'ORG', 'word': 'Alex', 'normalized': 'Alex', 'company_key': None, 'start': 766, 'end': 770, 'score': 0.9458091259002681}, {'entity_group': 'ORG', 'word': 'Ring', 'normalized': 'Ring', 'company_key': None, 'start': 776, 'end': 780, 'score': 0.8780466914176941}, {'entity_group': 'ORG', 'word': 'Amazon', 'normalized': 'AMZN', 'company_key': 'AMZN', 'start': 858, 'end': 864, 'score': 0.9972530007362361}, {'entity_group': 'ORG', 'word': 'Amazon', 'normalized': 'AMZN', 'company_key': 'AMZN', 'start': 896, 'end': 902, 'score': 0.9970955848693841}, {'entity_group': 'ORG', 'word': 'Ring', 'normalized': 'Ring', 'company_key': None, 'start': 912, 'end': 916, 'score': 0.9884206056594841}, {'entity_group': 'ORG', 'word': 'Ring', 'normalized': 'Ring', 'company_key': None, 'start': 1038, 'end': 1042, 'score': 0.987448036670684}, {'entity_group': 'ORG', 'word': 'FTC', 'normalized': 'FTC', 'company_key': None, 'start': 1159, 'end': 1162, 'score': 0.9977704286575311}, {'entity_group': 'ORG', 'word': 'Ring', 'normalized': 'Ring', 'company_key': None, 'start': 1171, 'end': 1175, 'score': 0.9779747724533081}, {'entity_group': 'ORG', 'word': 'Ring', 'normalized': 'Ring', 'company_key': None, 'start': 1301, 'end': 1305, 'score': 0.9929527640342711}, {'entity_group': 'ORG', 'word': 'FTC', 'normalized': 'FTC', 'company_key': None, 'start': 1733, 'end': 1736, 'score': 0.9977138638496391}, {'entity_group': 'ORG', 'word': 'Ring', 'normalized': 'Ring', 'company_key': None, 'start': 1787, 'end': 1791, 'score': 0.974461376667022}, {'entity_group': 'ORG', 'word': 'Ring', 'normalized': 'Ring', 'company_key': None, 'start': 1902, 'end': 1906, 'score': 0.9745851159095761}, {'entity_group': 'ORG', 'word': 'Amazon', 'normalized': 'AMZN', 'company_key': 'AMZN', 'start': 2142, 'end': 2148, 'score': 0.8736835718154901}, {'entity_group': 'ORG', 'word': 'U', 'normalized': 'U', 'company_key': None, 'start': 2272, 'end': 2273, 'score': 0.9976524710655211}, {'entity_group': 'ORG', 'word': 'S', 'normalized': 'S', 'company_key': None, 'start': 2274, 'end': 2275, 'score': 0.9936602711677551}, {'entity_group': 'ORG', 'word': 'Ring', 'normalized': 'Ring', 'company_key': None, 'start': 2362, 'end': 2366, 'score': 0.79845780134201}, {'entity_group': 'ORG', 'word': 'FTC', 'normalized': 'FTC', 'company_key': None, 'start': 2381, 'end': 2384, 'score': 0.7552579641342161}, {'entity_group': 'ORG', 'word': 'Ring', 'normalized': 'Ring', 'company_key': None, 'start': 2602, 'end': 2606, 'score': 0.7955581545829771}]","{'negative': 0.001446611946448, 'neutral': 0.000516225176397, 'positive': 0.9980371594429011}","{'anger': 0.467415183782577, 'neutral': 0.24858319759368802, 'disgust': 0.180708855390548, 'sadness': 0.054902710020542006, 'fear': 0.040174972265958, 'surprise': 0.00573780760169, 'joy': 0.0024772202596060004}",2023/f2a93ef5bbda58cb198dc87b80643075926c944496ed2f1a5fbadcf38cdc0bb1.json,5
